{
  "document_id": "CS_001",
  "source_files": ["data/raw_images/DataSet/cast study/CS_001.jpeg"],
  "page_count": 1,
  "document": {
    "document_type": "case_study",
    "form_version": "old",
    "page_side": "back",
    "case_number": null,
    "research_date": null,
    "source_entity": null
  },
  "office": {
    "directorate": "مديرية التضامن الاجتماعي بالمنوفية",
    "administration": null,
    "social_unit": null,
    "researcher_name": null,
    "requesting_entity": null,
    "research_purpose": null
  },
  "applicant": {
    "full_name": null,
    "national_id": null,
    "insurance_number": null,
    "age": null,
    "gender": null,
    "phone": null,
    "address": null,
    "governorate": null,
    "district": null,
    "marital_status": null,
    "education_status": null,
    "employment_status": null,
    "health_status": null
  },
  "family_members": [],
  "housing": {
    "type": null,
    "ownership": null,
    "area": null,
    "rooms_count": null,
    "rent_value": null,
    "independence": null,
    "water_source": "شبكة عمومية",
    "electricity": null,
    "appliances_condition": "الحالة جيدة"
  },
  "assets": {"properties": "لا يوجد حيازة"},
  "social_assessment": {
    "family_social_status": null,
    "health_notes": "جيدة",
    "economic_status": null,
    "family_needs": "مساعدة مالية",
    "researcher_summary": "ترى الوحدة مساعدة الحالة"
  },
  "checkbox_answers": [],
  "signatures": {
    "researcher_name": null,
    "unit_manager_name": null,
    "stamp_present": true
  },
  "uncertain_fields": [
    "social_assessment.family_social_status",
    "social_assessment.economic_status",
    "signatures.researcher_name"
  ],
  "review_required": false,
  "review_notes": ["old back page; several handwritten assessment lines are partially unreadable"]
}
