{
  "document_id": "CS_003",
  "source_files": ["data/raw_images/DataSet/cast study/CS_003.jpeg"],
  "page_count": 1,
  "document": {
    "document_type": "case_study",
    "form_version": "new",
    "page_side": "back",
    "case_number": null,
    "research_date": null,
    "source_entity": null
  },
  "office": {
    "directorate": null,
    "administration": null,
    "social_unit": null,
    "researcher_name": null,
    "requesting_entity": null,
    "research_purpose": null
  },
  "applicant": {
    "full_name": null,
    "national_id": null,
    "insurance_number": null,
    "age": null,
    "gender": null,
    "phone": null,
    "address": null,
    "governorate": null,
    "district": null,
    "marital_status": null,
    "education_status": null,
    "employment_status": null,
    "health_status": null
  },
  "family_members": [],
  "housing": {
    "type": null,
    "ownership": null,
    "area": null,
    "rooms_count": null,
    "rent_value": null,
    "independence": null,
    "water_source": null,
    "electricity": null,
    "appliances_condition": null
  },
  "assets": {"properties": null},
  "social_assessment": {
    "family_social_status": null,
    "health_notes": null,
    "economic_status": null,
    "family_needs": null,
    "researcher_summary": null
  },
  "checkbox_answers": [
    {"section": "الأجهزة المنزلية", "question": "هل لدى الأسرة أجهزة؟", "answer": "ثلاجة", "checked": true, "confidence": "medium"},
    {"section": "الأجهزة المنزلية", "question": "هل لدى الأسرة أجهزة؟", "answer": "غسالة", "checked": true, "confidence": "medium"},
    {"section": "التعليم", "question": "هل هناك أبناء في التعليم؟", "answer": "نعم", "checked": true, "confidence": "medium"},
    {"section": "الإنفاق", "question": "احتياجات/إنفاق الأسرة خلال الشهر", "answer": "نعم لبعض البنود", "checked": true, "confidence": "low"},
    {"section": "المرافق", "question": "نوع وصلة الكهرباء", "answer": "كهرباء", "checked": true, "confidence": "medium"}
  ],
  "signatures": {
    "researcher_name": null,
    "unit_manager_name": null,
    "stamp_present": false
  },
  "uncertain_fields": ["checkbox_answers"],
  "review_required": false,
  "review_notes": ["new back page; dense checkbox page photographed at an angle, only clearly marked boxes were captured"]
}
