{
  "document_id": "CS_004",
  "source_files": ["data/raw_images/DataSet/cast study/CS_004.jpeg"],
  "page_count": 1,
  "document": {
    "document_type": "case_study",
    "form_version": "new",
    "page_side": "front",
    "case_number": null,
    "research_date": null,
    "source_entity": null
  },
  "office": {
    "directorate": "المنوفية",
    "administration": null,
    "social_unit": null,
    "researcher_name": null,
    "requesting_entity": null,
    "research_purpose": null
  },
  "applicant": {
    "full_name": "غادة حسن عبد العزيز",
    "national_id": null,
    "insurance_number": null,
    "age": 44,
    "gender": "أنثى",
    "phone": null,
    "address": null,
    "governorate": null,
    "district": null,
    "marital_status": "أرملة",
    "education_status": "جامعي",
    "employment_status": "لا يعمل",
    "health_status": "جيدة"
  },
  "family_members": [
    {"row_index": 1, "name": "غادة حسن عبد العزيز", "relationship": "أم", "age": 44, "national_id": null, "marital_status": "أرملة", "education_status": "جامعي", "employment_status": "لا يعمل", "health_status": "جيدة", "notes": null},
    {"row_index": 2, "name": "رنا إبراهيم الطاهر", "relationship": "ابنة", "age": 21, "national_id": null, "marital_status": "طالبة", "education_status": null, "employment_status": "لا يعمل", "health_status": "جيدة", "notes": null},
    {"row_index": 3, "name": "سمر إبراهيم الطاهر", "relationship": "ابنة", "age": 20, "national_id": null, "marital_status": "طالبة", "education_status": null, "employment_status": "لا يعمل", "health_status": "جيدة", "notes": null},
    {"row_index": 4, "name": "ملك إبراهيم الطاهر", "relationship": "ابنة", "age": 18, "national_id": null, "marital_status": "طالبة", "education_status": null, "employment_status": "لا يعمل", "health_status": "جيدة", "notes": null},
    {"row_index": 5, "name": "كريم إبراهيم الطاهر", "relationship": "ابن", "age": 10, "national_id": null, "marital_status": "طالب", "education_status": null, "employment_status": "لا يعمل", "health_status": "جيدة", "notes": null}
  ],
  "housing": {
    "type": null,
    "ownership": null,
    "area": null,
    "rooms_count": null,
    "rent_value": null,
    "independence": null,
    "water_source": null,
    "electricity": null,
    "appliances_condition": null
  },
  "assets": {"properties": null},
  "social_assessment": {
    "family_social_status": null,
    "health_notes": null,
    "economic_status": null,
    "family_needs": null,
    "researcher_summary": null
  },
  "checkbox_answers": [
    {"section": "بيانات أولية", "question": "النوع", "answer": "أنثى", "checked": true, "confidence": "medium"},
    {"section": "الحالة الاجتماعية", "question": "الحالة الاجتماعية", "answer": "أرملة", "checked": true, "confidence": "medium"}
  ],
  "signatures": {
    "researcher_name": null,
    "unit_manager_name": null,
    "stamp_present": false
  },
  "uncertain_fields": ["applicant.full_name", "applicant.national_id", "family_members", "checkbox_answers"],
  "review_required": false,
  "review_notes": ["new front page; table handwriting is partially blurred"]
}
